{
  "schemaVersion": 1,
  "scenarioId": "myranth_local",
  "mapId": "myranth",
  "rulesetId": "aonw-standard",
  "initialUnits": [
    {
      "id": "player-1-commander",
      "ownerPlayerId": "player-1",
      "kind": "commander",
      "name": "Commander",
      "col": 6,
      "row": 4
    },
    {
      "id": "player-2-commander",
      "ownerPlayerId": "player-2",
      "kind": "commander",
      "name": "Commander",
      "col": 18,
      "row": 14
    },
    {
      "id": "player-3-commander",
      "ownerPlayerId": "player-3",
      "kind": "commander",
      "name": "Commander",
      "col": 18,
      "row": 4
    }
  ]
}
