{
  "schemaVersion": 1,
  "scenarioId": "myranth",
  "mapId": "myranth",
  "rulesetId": "aonw-standard",
  "initialUnits": [
    {
      "id": "preview-commander",
      "ownerPlayerId": "preview-player",
      "kind": "commander",
      "name": "Commander",
      "col": 12,
      "row": 11
    }
  ]
}
