{
  "schemaVersion": 1,
  "scenarioId": "terenos_local",
  "mapId": "terenos",
  "rulesetId": "aonw-standard",
  "initialUnits": [
    {
      "id": "player-1-commander",
      "ownerPlayerId": "player-1",
      "kind": "commander",
      "name": "Commander",
      "col": 4,
      "row": 3
    },
    {
      "id": "player-2-commander",
      "ownerPlayerId": "player-2",
      "kind": "commander",
      "name": "Commander",
      "col": 15,
      "row": 11
    },
    {
      "id": "player-3-commander",
      "ownerPlayerId": "player-3",
      "kind": "commander",
      "name": "Commander",
      "col": 15,
      "row": 3
    }
  ]
}
